{
  "id": "leadership-essentials",
  "slug": "leadership-essentials",
  "title": "Leadership Essentials",
  "summary": "Core skills for new and aspiring managers: delegation, feedback, and running effective 1:1s.",
  "description": "An interactive programme for first-time and aspiring managers covering the fundamentals of people leadership: setting expectations, delegating effectively, giving constructive feedback, and running productive one-to-ones. Includes role-play exercises and a take-home action plan.",
  "category": "Leadership & Management",
  "level": "Beginner",
  "format": "Hybrid",
  "durationValue": 3,
  "durationUnit": "weeks",
  "price": 750,
  "currency": "GBP",
  "tags": ["leadership", "management", "people-skills"],
  "prerequisites": [],
  "instructor": "Priya Anand",
  "active": true,
  "lastUpdated": "2026-06-20"
}
